{"$schema":"schemas/bioclock.schema.json","device":"ESP32 + MPU-6050 + MAX30102 (synthetic demo traces)","classifier":"edge motion+HR model, 3-state output","states":["asleep","drowsy","awake"],"samples":[{"restlessness":0,"state":"asleep","confidence":0.99,"hr":[52.373,51.595,52.185,53.528,52.509,54.282,54.393,52.846,54.137,53.927,52.348,52.971,53.08,52.314,52.371,52.695,50.678,50.56,51.217,50.187,50.494,50.4,49.872,50.237,51.25,51.083,51.767,50.946,51.137,52.594,52.409,53.567,52.909,52.922,54.136,52.821,54.2,53.146,53.612,53.022,52.605,53.155,53.276,51.277,50.686,51.17,50.585,50.49,50.583,49.653,51.054,49.459,50.525,51.024,50.825,50.705,51.771,51.675,53.042,52.259,53.806,54.07,52.451,53.433,52.847,53.432,53.231,52.412,54.026,52.457,52.508,51.773,51.158,51.685,50.591,50.64,51.242,50.546,50.099,50.634,50.508,50.003,50.652,50.675,52.248,51.692,52.91,52.36,52.987,53.206],"accel":[-0.012,-0.005,0.005,0.014,0.002,-0.017,0.019,-0.018,0.005,0.002,0.007,-0.018,0.007,0.018,0.011,0.018,0.005,-0.008,-0.012,0.005,-0.012,-0.015,0.008,0.01,0.011,0.012,-0.016,0.001,0.012,0.009,-0.002,-0.016,0.002,0.008,-0.003,0.015,0.006,-0.016,-0.001,-0.014,0.012,0.004,-0.017,0.005,-0.013,0.017,-0.017,0.019,0.003,-0.014,0.001,-0.009,-0.013,-0.007,0.002,0.002,-0.008,-0.017,-0.001,-0.003,-0.001,0.006,0.012,-0.011,0.01,0.011,0.016,0.001,0.017,0.002,0.014,-0.007,0.016,0.006,-0.015,0.002,0.004,-0.008,0.008,0.005,-0.019,-0.016,0.012,0.012,-0.013,-0.019,0.009,0.012,-0.01,-0.004]},{"restlessness":0.05,"state":"asleep","confidence":0.97,"hr":[54.865,53.748,53.682,54.087,53.936,54.014,55.632,55.395,55.044,56.058,54.807,55.53,55.083,54.45,53.864,52.828,52.795,53.671,52.61,51.462,52.717,52.334,51.455,51.654,51.982,53.218,52.803,54.231,52.425,54.176,53.346,55.322,53.882,54.922,56.326,56.228,55.057,54.459,55.947,55.49,53.634,53.457,54.279,53.704,53.776,53.656,53.524,51.465,53.242,53.283,52.174,53.264,53.132,52.697,52.164,53.604,52.731,53.773,53.768,54.658,53.65,54.922,55.075,56.413,56.412,55.437,56.097,55.002,53.983,55.05,53.566,54.674,54.08,53.701,53.25,51.596,52.298,52.985,53.156,52.72,52.294,52.461,53.204,51.947,52.773,54.62,52.849,53.173,54.973,55.911],"accel":[0.033,-0.042,0.037,0.029,-0.035,-0.037,-0.036,-0.023,-0.01,-0.011,0.007,-0.031,0.02,-0.019,-0.035,0,0.02,0.029,-0.023,-0.001,-0.042,-0.002,0.033,0.035,0.032,0.029,0,-0.017,0,-0.024,0.018,-0.009,-0.016,-0.041,-0.041,-0.001,0.023,0.019,0.038,0.039,-0.038,0.017,0.038,0.033,0.003,0.028,0.035,0.025,-0.042,0.023,0.006,0.02,0.002,0.009,0.037,-0.002,0.036,-0.029,-0.006,-0.027,0.03,0.027,0.022,0.025,-0.004,0.009,-0.008,0.031,0.029,-0.03,0.02,0.003,0.021,0.003,-0.002,0.019,-0.015,0.04,0.003,0.007,0.004,0.026,-0.031,0.001,-0.003,0.035,-0.038,-0.037,-0.024,0.018]},{"restlessness":0.1,"state":"asleep","confidence":0.9,"hr":[54.276,54.797,56.465,55.297,56.648,57.716,56.241,57.659,56.098,55.576,56.846,55.649,55.034,54.798,55.871,54.208,53.925,54.29,54.311,53.855,53.03,52.945,54.173,55.179,54.94,52.925,54.996,55.171,56.289,55.634,54.81,55.454,55.51,56.684,57.59,56.37,55.657,57.197,55.973,57.35,56.659,54.998,54.9,54.9,54.596,55.464,55.488,54.112,53.197,53.992,53.269,52.533,54.414,53.038,53.549,55.735,54.816,55.897,55.565,56.916,55.502,57.732,57.175,57.1,58.11,57.958,56.731,55.543,56.537,55.564,56.751,55.385,55.676,54.886,55.128,52.914,54.775,54.15,55.063,54.705,52.572,55.058,53.32,53.967,55.97,54.667,54.601,54.848,55.437,57.626],"accel":[-0.042,-0.001,-0.045,-0.015,0.016,0.062,0.019,0.049,-0.029,-0.051,-0.039,-0.043,-0.035,0.02,0.05,0.052,0.026,0.055,-0.052,-0.03,0.049,-0.065,0.021,0.035,-0.029,-0.016,-0.028,0.026,0.05,0.004,0.041,-0.041,0.286,0.003,0.041,-0.05,0,-0.022,-0.005,0.026,-0.039,-0.023,-0.027,0.001,-0.015,0.059,-0.06,0.004,-0.028,-0.036,-0.05,-0.003,-0.009,0.064,-0.014,0.006,0.026,0.046,0.024,0.009,-0.022,0.003,-0.032,-0.002,-0.045,0.006,0.006,-0.035,0.031,-0.036,0.094,0.037,0.011,0.048,-0.058,0.053,-0.002,0.035,-0.024,-0.035,-0.045,0.02,0,-0.045,-0.053,0.062,-0.012,0.039,-0.048,-0.037]},{"restlessness":0.15,"state":"asleep","confidence":0.83,"hr":[55.875,57.615,57.769,59.465,57.521,57.796,58.304,57.867,59.152,59.981,58.64,56.687,56.639,57.211,55.975,56.344,55.114,54.864,56.711,54.894,55.711,54.593,54.578,56.39,55.541,56.458,55.925,56.613,57.035,57.512,56.173,59.354,59.678,58.597,59.191,58.822,59.174,57.532,59.558,58.407,56.817,58.098,57.16,57.77,57.816,57.246,56.509,54.712,54.315,54.751,55.522,55.276,55.521,55.079,57.233,57.065,57.078,56.162,58.395,56.667,59.274,58.35,59.586,59.948,60.047,57.314,59.586,57.181,58.325,57.8,57.452,56.838,57.724,56.12,55.771,56.709,56.462,54.924,55.086,55.325,55.477,54.684,56.127,55.211,56.081,55.754,57.24,57.074,57.442,58.522],"accel":[-0.071,0.047,0.086,0.027,0.05,-0.004,-0.072,-0.039,-0.003,-0.082,-0.024,-0.069,-0.06,-0.027,-0.048,-0.017,-0.019,0.04,0.081,-0.04,-0.052,0.033,-0.03,-0.084,-0.083,-0.078,0.004,0.07,0.005,-0.032,0.05,-0.065,0.049,-0.002,-0.078,-0.024,0.063,0.017,-0.046,0.007,-0.076,0.226,0.06,0.078,-0.081,0.015,-0.022,0.006,-0.078,0.075,-0.011,0.049,0.421,0.028,0.044,0.087,-0.059,0.049,0.068,0.03,0.084,0.067,-0.039,0.032,-0.032,0.077,-0.083,-0.025,-0.075,0.081,0.02,0.364,-0.077,0.073,-0.039,0.071,0.039,-0.012,-0.081,0.044,0.064,0.062,0.058,-0.028,0.038,0.307,0.064,-0.052,-0.081,-0.019]},{"restlessness":0.2,"state":"asleep","confidence":0.76,"hr":[59.478,59.034,57.852,58.309,60.331,59.714,61.319,59.206,59.45,59.563,59.074,58.594,61.152,59.06,59.904,56.915,56.946,56.708,56.323,59.004,57.118,58.221,55.979,56.552,55.966,58.202,56.633,58.659,57.102,58.516,60.491,60.613,60.014,58.915,59.781,59.301,61.993,61.343,59.213,59.491,59.559,61.125,58.573,58.47,57.745,56.608,57.546,57.608,57.542,58.248,56.472,58.043,56.171,57.998,56.308,59.447,57.357,59.826,58.557,58.398,59.721,60.598,61.52,60.494,60.287,61.56,58.609,61.022,59.355,58.279,58.095,58.31,59.57,57.015,56.731,56.932,57.945,57.447,58.809,56.103,55.848,57.871,56.072,57.892,59.63,59.753,59.542,57.762,58.862,58.24],"accel":[-0.022,-0.08,0.061,-0.045,-0.108,-0.107,-0.054,-0.093,-0.033,-0.023,-0.028,-0.074,-0.043,0.06,0.095,0.003,-0.038,0.092,-0.076,0.004,0.095,-0.052,0.031,0.496,-0.005,0.009,-0.004,-0.003,-0.1,0.436,0.574,0.053,-0.091,-0.026,0.013,-0.013,-0.082,0.016,0.053,-0.006,-0.069,-0.064,0.067,-0.099,0.314,0.058,0.093,-0.044,-0.022,0.073,0.413,0.09,-0.001,-0.048,0.031,-0.062,0.06,-0.066,0.002,0.034,-0.091,0.008,0.078,-0.049,0.01,0.02,0.087,-0.023,-0.056,-0.026,-0.007,0.099,-0.012,0.065,-0.092,0.033,0.022,0.048,-0.025,0.095,-0.075,-0.107,-0.074,0.073,0.108,-0.019,-0.004,0.064,0.054,0.018]},{"restlessness":0.25,"state":"asleep","confidence":0.69,"hr":[59.319,60.986,59.657,62.609,62.887,61.271,62.78,62.077,61.834,63.166,62.523,63.133,62.755,59.472,61.811,59.044,58.069,59.586,58.993,60.722,59.566,58.455,59.109,60.413,58.009,58.988,60.935,58.274,59.738,59.912,61.817,60.361,60.677,62.911,63.341,63.327,63.948,63.532,62.384,61.672,61.668,62.155,59.312,59.751,60.788,61.28,59.916,59.567,57.589,59.58,60.013,58.905,57.304,59.678,60.086,61.217,58.441,60.925,59.119,60.942,59.798,60.964,62.999,61.909,61.69,62.783,60.821,63.345,62.661,61.368,60.642,60.273,59.42,58.918,60.728,58.539,59.512,57.369,57.065,58.895,58.786,58.958,60.621,58.644,61.727,58.398,59.22,59.807,59.666,60.096],"accel":[-0.069,0.12,0.04,-0.049,0.54,0.417,0.014,0.263,-0.106,-0.004,0.059,-0.058,-0.057,0.017,0.047,0.048,0.102,-0.025,0.085,0.241,-0.096,0.13,0.128,0.102,-0.002,0.079,-0.04,0.116,0.018,0.369,-0.002,-0.074,0.074,-0.062,-0.098,0.063,-0.125,-0.001,0.284,-0.112,0.084,-0.045,-0.126,0.08,-0.092,-0.125,0.393,0.062,-0.126,0.033,-0.026,-0.098,-0.099,-0.087,-0.125,-0.035,0.094,-0.009,0.117,-0.105,0.118,-0.009,0.059,0.354,-0.043,0.045,0.103,-0.061,0.416,0.051,0.21,-0.122,0.115,-0.124,-0.04,0.053,0.069,0.132,-0.014,0.127,-0.001,0.006,-0.125,-0.082,0.399,-0.049,-0.071,0.006,-0.052,0.082]},{"restlessness":0.3,"state":"asleep","confidence":0.62,"hr":[63.639,61.317,60.995,62.301,64.907,62.995,63.087,62.93,65.253,62.122,62.637,64.873,64.345,63.005,63.067,60.822,59.649,60.474,60.593,62.261,62.513,60.683,59.436,58.97,61.275,59.658,60.503,63.403,60.592,64.176,62.927,63.568,65.017,63.786,65.249,62.873,65.812,65.101,62.824,61.675,63.461,61.656,61.957,62.775,63.75,63.148,60.102,59.154,58.762,60.947,61.561,59.103,59.215,62.193,60.488,63.053,59.929,64.023,62.507,61.163,64.863,61.792,64.422,62.148,64.422,62.25,61.993,62.908,64.039,64.056,61.489,62.379,62.889,60.126,63.072,62.155,61.267,61.66,60.8,61.312,58.652,60.114,61.794,62.817,61.783,62.011,63.749,63.839,64.236,65.091],"accel":[0.047,0.055,-0.019,-0.133,-0.026,0.023,-0.143,-0.006,0.003,-0.152,0.078,-0.08,0.1,-0.022,-0.106,0.013,0.068,-0.142,0.057,0.025,-0.069,-0.022,-0.024,0.331,0.009,-0.056,0.674,0.094,-0.082,0.132,0.011,-0.099,-0.136,0.008,0.035,0.099,-0.103,0.041,-0.135,-0.011,-0.042,0.131,0.09,-0.017,0.108,0.129,-0.011,0.006,0.142,0.007,0.663,-0.14,0.097,-0.047,0.64,-0.114,-0.138,-0.109,-0.066,0.551,-0.05,-0.125,0.023,0.028,0.527,-0.129,0.129,0.079,-0.154,-0.001,0.135,-0.01,-0.128,-0.102,-0.057,0.054,0.123,-0.14,-0.009,0.022,0.044,-0.055,0.053,0.019,0.084,0.096,-0.102,0.031,-0.078,-0.102]},{"restlessness":0.35,"state":"drowsy","confidence":0.55,"hr":[65.289,64.311,63.132,67.028,63.567,63.834,64.989,63.662,67.316,65.968,62.996,64.47,65.967,66.275,62.677,63.848,64.196,64.806,64.009,63.627,64.49,63.425,60.158,62.53,61.338,64.305,63.809,61.138,63.891,66.234,62.793,66.879,64.068,63.905,67.36,63.701,66.705,63.484,64.672,63.061,63.425,66.635,65.085,64.237,64.783,64.295,62.261,60.516,63.719,63.873,61.928,63.436,62.152,62.938,60.737,63.02,64.811,64.954,66.405,64.223,66.715,63.315,67.465,63.373,67.328,65.397,65.99,65.059,63.549,64.922,66.256,63.698,61.739,65.322,62.916,60.984,61.247,62.317,62.13,63.687,62.2,63.653,63.72,61.685,61.968,61.683,63.625,63.221,62.596,66.331],"accel":[-0.144,-0.042,0.11,0.147,0.112,0.019,-0.087,-0.142,0.085,0.154,0.172,0.393,0.122,0.734,-0.025,0.146,0.159,0.119,0.069,-0.063,-0.128,0.233,0.06,0.11,-0.103,-0.062,0.36,-0.045,0.166,0.054,0.177,-0.115,0.11,-0.035,-0.153,0.084,0.151,-0.103,0.136,-0.16,